{
  "catalog_version": "0.4.2",
  "schema_version": "1.0.1",
  "updated_at": "2026-08-10",
  "models": [
    {
      "id": "voxtral-mini-3b",
      "name": "Mistral Voxtral Mini 3B (lote)",
      "task": "asr",
      "languages": [
        "en",
        "zh",
        "hi",
        "es",
        "ar",
        "fr",
        "pt",
        "ru",
        "de",
        "ja",
        "ko",
        "it",
        "nl"
      ],
      "runtime": "other",
      "format": "safetensors",
      "quantization": null,
      "streaming": false,
      "timestamps": "segment",
      "punctuation": true,
      "diarization": false,
      "status": "pending_hash",
      "sha256": "",
      "size_bytes": null,
      "source_url": "https://huggingface.co/mistralai/Voxtral-Mini-3B-2507",
      "download_url": null,
      "license": "Apache-2.0",
      "license_verified_at": "2026-08-08",
      "wer_reference": [
        {
          "benchmark": "Open ASR Leaderboard multilíngue (paper, Tabela 4, snapshot 2025-10)",
          "language": "pt",
          "value_percent": 4.8,
          "source_url": "https://arxiv.org/html/2510.06961v1",
          "consulted_at": "2026-08-08"
        }
      ],
      "requirements": {
        "class_a": {
          "supported": true,
          "min_ram_mb": 8192,
          "min_vram_mb": null,
          "estimated": true
        },
        "class_b": {
          "supported": false,
          "min_ram_mb": null,
          "min_vram_mb": null,
          "estimated": true
        },
        "class_c": {
          "supported": true,
          "min_ram_mb": 8192,
          "min_vram_mb": 10240,
          "estimated": true
        },
        "class_d": {
          "supported": false,
          "min_ram_mb": null,
          "min_vram_mb": null,
          "estimated": true
        }
      },
      "recommended": false,
      "notes": "Melhor qualidade de lote medida no corpus próprio: WER 1,47 % (leitura, 2026-08-09, via Transformers/MPS — bench, fora do produto; bench/results/validacao_alternativas_20260809.md). Correção 2026-08-10 (ADR-0003): o llama.cpp SUPORTA o Mini 3B em lote via mtmd (o \"not planned\" era só do Realtime 4B) — via elegível na PoC da F2 (D4), com artefato por conversão própria ou decisão de proveniência sobre o GGUF da ggml-org (E5). pending_hash até a PoC aprovar a via."
    },
    {
      "id": "qwen3-asr-1.7b",
      "name": "Qwen3-ASR 1.7B",
      "task": "asr_streaming",
      "languages": [
        "pt",
        "en",
        "es",
        "fr",
        "de",
        "it",
        "ja",
        "ko",
        "ru",
        "ar",
        "zh"
      ],
      "runtime": "other",
      "format": "safetensors",
      "quantization": null,
      "streaming": true,
      "timestamps": "none",
      "punctuation": true,
      "diarization": false,
      "status": "pending_hash",
      "sha256": "",
      "size_bytes": null,
      "source_url": "https://huggingface.co/Qwen/Qwen3-ASR-1.7B",
      "download_url": null,
      "license": "Apache-2.0",
      "license_verified_at": "2026-08-08",
      "wer_reference": [],
      "requirements": {
        "class_a": {
          "supported": true,
          "min_ram_mb": 6144,
          "min_vram_mb": null,
          "estimated": true
        },
        "class_b": {
          "supported": false,
          "min_ram_mb": null,
          "min_vram_mb": null,
          "estimated": true
        },
        "class_c": {
          "supported": true,
          "min_ram_mb": 6144,
          "min_vram_mb": 6144,
          "estimated": true
        },
        "class_d": {
          "supported": false,
          "min_ram_mb": null,
          "min_vram_mb": null,
          "estimated": true
        }
      },
      "recommended": false,
      "notes": "Streaming+lote unificados; competidor do Nemotron 3.5 na PoC de streaming da F2 (item (f) do PRB-0019; matriz fixada no ADR-0003 D2: lote via llama.cpp/mtmd, streaming só por re-janelamento — o modo oficial é Transformers/vLLM, inelegível). WER próprio 2,56 % (leitura, 2026-08-08, MLX comunitário). Variante 0.6B existe para classes menores. Empacotamento tar.gz na adoção (precedente PRB-0017); WER pt publicado a extrair do relatório técnico (arXiv 2601.21337)."
    },
    {
      "id": "whisper-large-v3-turbo-q5",
      "name": "Whisper large-v3-turbo (GGUF q5_0)",
      "task": "asr",
      "languages": [
        "*"
      ],
      "runtime": "whisper_cpp",
      "format": "gguf",
      "quantization": "q5_0",
      "streaming": false,
      "timestamps": "segment",
      "punctuation": true,
      "diarization": false,
      "status": "available",
      "sha256": "394221709cd5ad1f40c46e6031ca61bce88931e6e088c188294c6d5a55ffa7e2",
      "size_bytes": 574041195,
      "source_url": "https://huggingface.co/openai/whisper-large-v3-turbo",
      "download_url": "https://huggingface.co/ggerganov/whisper.cpp/resolve/main/ggml-large-v3-turbo-q5_0.bin",
      "license": "Apache-2.0",
      "license_verified_at": "2026-08-03",
      "wer_reference": [],
      "requirements": {
        "class_a": {
          "supported": true,
          "min_ram_mb": 3072,
          "min_vram_mb": null,
          "estimated": true
        },
        "class_b": {
          "supported": true,
          "min_ram_mb": 3072,
          "min_vram_mb": null,
          "estimated": true
        },
        "class_c": {
          "supported": true,
          "min_ram_mb": 2048,
          "min_vram_mb": 2048,
          "estimated": true
        },
        "class_d": {
          "supported": false,
          "min_ram_mb": null,
          "min_vram_mb": null,
          "estimated": true
        }
      },
      "recommended": false,
      "notes": "Instalável desde a sessão 03 (hash calculado da fonte primária). WER próprio 11,02 % em leitura pt-BR com colapso de repetição de ~90 s (bench/results/wer_4motores_20260808.md) — confiabilidade, não qualidade média, é o problema; preferir large-v3 quando robustez importa."
    },
    {
      "id": "whisper-large-v3-q5",
      "name": "Whisper large-v3 (GGUF q5_0)",
      "task": "asr",
      "languages": [
        "*"
      ],
      "runtime": "whisper_cpp",
      "format": "gguf",
      "quantization": "q5_0",
      "streaming": false,
      "timestamps": "segment",
      "punctuation": true,
      "diarization": false,
      "status": "available",
      "sha256": "d75795ecff3f83b5faa89d1900604ad8c780abd5739fae406de19f23ecd98ad1",
      "size_bytes": 1081140203,
      "source_url": "https://huggingface.co/openai/whisper-large-v3",
      "download_url": "https://huggingface.co/ggerganov/whisper.cpp/resolve/main/ggml-large-v3-q5_0.bin",
      "license": "Apache-2.0",
      "license_verified_at": "2026-08-03",
      "wer_reference": [],
      "requirements": {
        "class_a": {
          "supported": true,
          "min_ram_mb": 4096,
          "min_vram_mb": null,
          "estimated": true
        },
        "class_b": {
          "supported": true,
          "min_ram_mb": 4096,
          "min_vram_mb": null,
          "estimated": true
        },
        "class_c": {
          "supported": true,
          "min_ram_mb": 2048,
          "min_vram_mb": 3072,
          "estimated": true
        },
        "class_d": {
          "supported": false,
          "min_ram_mb": null,
          "min_vram_mb": null,
          "estimated": true
        }
      },
      "recommended": false,
      "notes": "Máxima robustez multilíngue em áudio adverso; mais lento que o turbo."
    },
    {
      "id": "parakeet-tdt-0.6b-v3-int8",
      "name": "NVIDIA Parakeet-TDT 0.6B v3 (ONNX int8)",
      "task": "asr",
      "languages": [
        "bg",
        "hr",
        "cs",
        "da",
        "nl",
        "en",
        "et",
        "fi",
        "fr",
        "de",
        "el",
        "hu",
        "it",
        "lv",
        "lt",
        "mt",
        "pl",
        "pt",
        "ro",
        "sk",
        "sl",
        "es",
        "sv",
        "ru",
        "uk"
      ],
      "runtime": "onnx",
      "format": "onnx",
      "quantization": "int8",
      "streaming": false,
      "timestamps": "word",
      "punctuation": true,
      "diarization": false,
      "status": "pending_hash",
      "sha256": "",
      "size_bytes": null,
      "source_url": "https://huggingface.co/nvidia/parakeet-tdt-0.6b-v3",
      "download_url": null,
      "license": "CC-BY-4.0",
      "license_verified_at": "2026-08-03",
      "wer_reference": [
        {
          "benchmark": "Fleurs (pt)",
          "language": "pt",
          "value_percent": 4.76,
          "source_url": "https://huggingface.co/nvidia/parakeet-tdt-0.6b-v3",
          "consulted_at": "2026-08-03"
        },
        {
          "benchmark": "Open ASR Leaderboard (média multilíngue)",
          "language": "multi",
          "value_percent": 6.34,
          "source_url": "https://huggingface.co/nvidia/parakeet-tdt-0.6b-v3",
          "consulted_at": "2026-08-03"
        }
      ],
      "requirements": {
        "class_a": {
          "supported": true,
          "min_ram_mb": 2048,
          "min_vram_mb": null,
          "estimated": true
        },
        "class_b": {
          "supported": true,
          "min_ram_mb": 2048,
          "min_vram_mb": null,
          "estimated": true
        },
        "class_c": {
          "supported": true,
          "min_ram_mb": 2048,
          "min_vram_mb": 2048,
          "estimated": true
        },
        "class_d": {
          "supported": true,
          "min_ram_mb": 2048,
          "min_vram_mb": null,
          "estimated": true
        }
      },
      "recommended": false,
      "notes": "Melhor custo-benefício pt em lote (cartão oficial: ≥2 GB RAM). Suporte sherpa-onnx confirmado em 2026-08-03: artefato int8 oficial nos releases do projeto (somente lote, não streaming). WER pt-BR próprio pendente (PRB-0014)."
    },
    {
      "id": "canary-1b-v2",
      "name": "NVIDIA Canary-1B v2",